"User","Comment","Rating","Date"
"eddie_baggins","I'm not ashamed to admit I've seen some movies in my time.I am however ashamed to admit curiosity got the better of me and I ended up in an almost entirely empty cinema screening (thanks to one tolerant movie buddy who joined me on my trip to the local cinema) partaking in what can only be described as one of the most universally panned Hollywood blockbusters of the modern era.Not at all interested in watching another Sony Marvel outing after their last few efforts, hearing about the insanely awesome awfulness of Madame Web from friends, internet identities and esteemed critics made me want to witness a potential all-time cringe-fest and while when people are absolutely right in their hyperbole around just how bad Madame Web is, I'm still trying to comprehend how I could possibly testify to just how bad things are here.Directed by long time TV episode director S. J. Clarkson and featuring a cast of performers who have all proven over time to be more than capable of bringing the goods, Madame Web is not devoid of talent that may have been able to salvage some type of goodness from an offence against the entire cinematic medium but as a finished? (Honestly I am unsure how anyone could claim this is an acceptable final version, just watch for some of the most flawed examples of ADR you're ever going to see) product there was no one or any thing that could've saved this nightmare from the fate it had created for itself.An experience that could only possibly come from a collective group who all gave up the fight to save it long before shooting had wrapped, Madame Web inexcusably comes from the same penmanship that was guilty of unleashing Morbius on us but screenwriters Matt Sazama and Burk Sharpless at least managed to find some cult like goodness in Jared Leto and Matt Smith's wildly OTT characters and bizarre action segments but Madame Web is nothing more than two hours of terrible plot, characters, spectacle and intentions and there is quite literally no valid reason for this movie to exist in the form it has been given.One of the most atrociously acted Hollywood films ever captured, with lead Dakota Johnson unable to hold back her disdain for a film she clearly hated being a part of and poor old Tahar Rahim taking the films most unfortunate mantle from a wigged Sydney Sweeney, Madame Web may have been promoted as some type of intense action thriller following the exploits of Johnson's Cassandra Webb as she battles Rahim's Ezekiel Sims alongside Sweeney's Julia, Isabela Merced's Anya and Celeste O'Connor's Mattie but we get something else entirely that is hard to come to terms with.From some of the most detestable and frequent examples of product placement that becomes instantly iconic (some viewers may find themselves attempting to crack open a Pepsi can in their Calvin Klein's after a viewing), a villain we literally know nothing about with zero attempts to bother explaining his plans or background, an embarrassing use of comic staple characters that aren't even put into action outside of dream sequences and a script that must surely have been conjured on ChatGPT, Madame Web is a cesspool of Hollywood excrement that isn't even funny in its horribleness, just merely sad and depressing.The only justifiable reason for Madame Web to be the film it is as it stands is if Sony are deliberately attempting to sabotage their Marvel property that no longer is allowed to include many fan favourites, if they aren't in fact doing that there is zero excuses for why Madame Web has ever been allowed to be birthed into existence.An irredeemable, amateurish and embarrassing exercise in pointless, Madame Web is a shockingly bad example of blockbuster filmmaking that is the exact type of bottom feeder product the cinema industry and the Marvel brand didn't need at this particular point of time.Final Say -If you're a glutton for punishment and want to be reminded of everything you wouldn't wish to see in a supposed piece of big screen entertainment then Madame Web is for you! A truly iconic new addition to the staples of all-time misfires, nothing could prepare one for the garbage that is this $80 million dollar disasterpiece.0 fireworks to the head out of 5.Jordan and Eddie (The Movie Guys)","1","22 February 2024"
"shaikhirshad-41223","Literally I had zero expectations when I went to watch this flick but I still thought that something should be good in this to watch at least one time because of marvel name in it. But this movie is so low and looks like low budget CGI thriller and a comedy in the name of superhero genre.I mean from the start itself movie lost it's pace and story and god only knows what are they showing no interest in the screenplay and the plot is not even engaging to watch for at least 30 mins.I only went for Dakota & Sydney just because the screen presence of them looks good, but the director loss this opportunity too. Because the character they're playing is so bad and not even proper dialogues are given and just they have made a common character with no story arc just the situation that they have to act
I've never seen such a bad cinematography of any film it looks like they don't have any interest making this film so they just made a spoof just to show that we are making a movie. Don't know what to say more because this film is that bad.Overall a Boring fest and a spoof fo a superhero genre.","2","16 February 2024"
"vengeance20","Ok, so before people come at me with the ""YoU dIdN't LiKe It BeCaUsE iT wAs FeMaLe LeAd."" chestnut. I went into this one with an open mind, but expecting it to be as described & the reviews were right. The film is bad.The film sees Cassandra Webb who is a New York metropolis paramedic who begins to demonstrate signs of clairvoyance. Forced to challenge revelations about her past, she needs to safeguard 3 young girls from a deadly adversary who wants them destroyed.I found the film to be pretty bad. It's disjointed, clunky, poorly paced & just feels very awkward & stiff. The characters are personality-less, they look & sound as if they're reciting their lines from cue cards (almost robotic, I might add) & the script reads like a supermarket shopping receipt.The films story is all over the place, confusing & hard to follow. The premonition sequences the main lead experiences were annoying & while creative, were repetitive to the point where you couldn't tell if she was hallucinating or actually seeing what she was seeing.The films runtime is overly long for what it is, while not as bad as other films which are generally over 2 hours (rolls eyes), this film felt longer & as I said was too long for what it was at 1 hour & 48 minutes (108 minutes) without credits & the pacing, jeez... don't get me started.The actors were alright, but what they were given script wise, didn't work & made them come across as flat. There's some action & not bad effects to be had, but that's pretty much the only redeeming features from this flick, sadly. It hasn't a lot going for it & is pretty lack luster & basic.Don't get me wrong, I prefer films with straight forward story-lines & plots you can follow, but this one was a bit too basic & could've used more meatiness to beef it up more as well as more emphasis to keep the audience engaged with the story, characters, action etc.I generally didn't like the film & the ending is just out there too & is pretty cringy like some of the scenes in the film as well as the few cringy action sequences themselves among some of the good action we got.Overall, it's a bad film. And no, it's got nothing to do with the old chestnut of me being a man who doesn't like the film because it's female lead. The film was bad & had plenty of things wrong with it. People in general, men & women, boys & girls, didn't like this flick.The story is bland, boring & paper thin like the characters & leads, the little bit of good action & effects seen are overshadowed by the aforementioned issues as well as the other issues like the poor runtime, pacing & the lacking engagement the film has.Also, for those who can't seem to get it in their heads, there's been plenty of female lead films in the past that have done well, from the Alien Franchise to The Hunger Games along with Elektra, Tomb Raider, Salt, Lucy, Hanna etc. I could go on but that's my rant for those who need calling out.2/10.","2","20 February 2024"
"izadyardariush","I could tell from the beginning, making this movie was a bad idea. After I saw the cast I could tell this movie doomed. I have nothing against any of those actors but I must say casting a Dakota was a biggest mistake for the role! Anyone read the comics could say that. This movie was like terminator meeting final destination! No good story, big mess, lot of waste of potentials. I must say worst choice of villain! We have good movies, bad movies but like to watch but this was bad bad like that bad I was torturing myself to sit through the whole movie. I wonder do they even watch their movie?!!$","1","14 February 2024"
"alindsayal","With Marvel Studios taking on more responsibility involving Spider-Man, Sony have decided to try and build a universe involving smaller characters from the same lore as him. We have had Venom and Morbius and will get Kraven The Hunter later this year but here we have Madame Web. I saw this film last night and here is my review for Madame Web. The p[remise of the film sees a women bestowed with powers where she has to save 3 girls from being killed by a villainous foe.Main Character
I must be honest that I have never been a huge fan of Dakota Johnson and she plays Cassandra Web here and I have to be honest she isn't particularly good here. She is overacting everything here and her character is super unlikeable and hard to care about. She is clearly hampered by the awful writing in this film and she can't rise above it and give us a lead role to support or care about and Cassie Web will go down as one of the worst leads in a comic book film ever.Supporting Characters
Sydney Sweeney, Isabela Merced & Celeste O'Connor play the three girls that are in the view of the villain and they are all pretty awful. Their characters are really awkward and not particularly likeable, the film tries to force you to like and care about these characters but it comes across poorly and these actresses aren't good enough to make me care.Tahar Rahim plays Ezekiel Sims and he is one of the more frustrating parts of this film because I have seen him be a good actor and this character had some potential but the film really flops here and makes him this over the top villain that is so stupid that it really takes you out of the film.Adam Scott as Ben Parker is probably the best person here but he isn't really given much to do and it still upsets me that he plays Ben Parker and it is really clear that this was just done to provide some stupid fan service that actually annoys me even more.Story
The story is nonsensical and completely stupid. The plot makes no sense and characters do things that make no sense, Cassie Web in particular is one of the dumbest characters that I have seen in recent movies. This film also tries its best to ruin the character of Spider-Man even though he isn't in the film and it is just the backdrop to this pretty dull and horrendous adventure.Script
This is a really awfully written film. Things make no sense, characters are unlikeable and there is no humour here at all. There are so many plot holes it is crazy and the film has nothing interesting about it at all.Style
I mean I guess the action scenes are okay and the bad guys suit was okay but that is it. The film is filmed really poorly, the editing looks unfinished and at times it is actually quite jarring to watch it. There are way too many jump scares especially for a film that is not a horror film. The trailer shows things that barely happen in the film and it feels like we were sold a different film that never got made.Overall
Overall, Madame Web is a truly disastrous film. This is up there with one of the worst films I have ever seen and is up there with the worst comic book films of all time. Though I am glad I saw this film to have this experience but at all cost avoid this garbage and do something better for 2 hours.Rating - 1/10.","1","16 February 2024"
"daisukereds","A baby-sitting movie in a Superhero setting, where the lead can see the future and has to prevent NOT-Spiderman from killing teenagers (because he has dreams/visions about them). The girls run and hide around a lot, some BS happens and then the movie ends.The foundation of the script is heavily written around a hollow core of ""parents and children"". The cinematography is actually good, and at least ""teaches"" how to do CPR. It also does away with showing premonitions every time something is to be changed near the end.. respecting the viewers intelligence in at least that aspect! And it's easy to follow (if you don't fall asleep) with how simplistic it is.Aside from that, it is barely anything else..
The movie itself isn't terrible.. it's just beyond bland and boring. Also, calling this a Superhero movie is really disingenuous and a marketing ploy to get people to see it. Stay home! There are no good action sequences and nobody is written memorably....
Venom making money was a mistake. Sony has half a franchise, and they can't get anyone talented enough to do something with it. And what they continue to release seems like high-budgeted fan fiction!","3","16 February 2024"
"isaacsundaralingam","Yea, this was garbage and that's saying plenty. It's actually adorable how little anyone cared about ""Madame Web"" - not just the audience, but the filmmakers and actors themselves. Written by the same people who wrote ""Morbius"", this movie is yet another reason to not let them anywhere near a writing software ever again.Not only was the movie unwatchable due to how lifeless it was, but it was also criminally boring. You're waiting for something to happen and you keep waiting right until the credits start to roll. Nothing about the movie was compelling, the plot was riddled with plot holes, the screenplay was lazy, the dialogues were dead and the acting was almost as if the actors were held captive and being forced to act as if everything was okay. It reeks of corporate greed and there isn't a single positive thing to say about this movie.We're only a month and half into the year and we already have a very strong contender for what might be the worst movie of the year, and it's not even close. Don't watch it, but if you do indeed decide to, I hope you lived a life well enough to have a crowded funeral.","1","19 February 2024"
"syntory","Look at the profiles for the writers that wrote Madame Web. You'll see virtually every movie they've written has a bad rating and bad reviews. Why then does Hollywood continually hire these same writers for these big budget films? I could understand if they wrote movies for Asylum Films because all their movies are terrible.Madame Web is god awful! Very difficult to sit through. None of the main characters are likeable. Even the villain is lame. It seems like the entire movie was written to set up a sequel. But why would people spend money to see the sequel of a movie that is one of the worst movies ever written? I'm shocked at how bad this movie is and if there is a sequel I certainly wont bother watching it.Stop hiring bad writers, Hollywood!","2","15 February 2024"
"MovieWarfare","I would absolutely love to be in these Sony meetings because I am absolutely baffled how things like Madame Web are getting greenlit.Madame Web is one of the worst superhero movies ever made! It has terrible writing, characters, action setpieces and even acting. Dakota Johnson is so dull and boring as the main lead but this is probably down to the terrible script.To be fair, the movie does have an interesting concept with this Final Destination x Terminator thing. However, it is so poorly executed that it makes Morbius look like The Dark Knight.Anyway give me the ""He Was in the Amazon With My Mom When She Was Researching Spiders Right Before She Died"" cut!","1","17 February 2024"
"chenp-54708","Literally one of the worst superhero movies I have ever seen.From the advertisements, I knew this movie wasn't going to be great but still, it surprised me how bad and boring it was. Everything about the direction, writing, characters, technical aspects, and designs are really awful. The writing is poor as there are many concepts, ideas and aspects that are messy and bland. The messy script creates poor dialogue from the cast and the characters are not interesting. The special effects looked even worse than the marketing and all of the performances were pretty bad. I honestly do feel bad for Dakota Johnson cause she is a good actress but she deserves to have better roles then this. It can be said for the same for the rest of the cast members.The uses of product placements are annoying, action moments are dull, and and all in all, it was boring. Superhero movies shouldn't be boring but this really dragged on. It's unfortunate cause female superhero leads are something I love to see more like Wonder Woman and The Old Guard which are pretty fun. But unfortunately, it seemed that it likely isn't going to happen anytime soon.There really isn't anything else to say.Bad.","1","14 February 2024"
"AlsExGal","... when I saw Dakota Johnson was starring in it. Naturally I can't lay the entirety of this hot mess at her feet. But there is some really bad campy acting happening on her part, reminiscent of the Fifty Shades of Grey movies in which she starred. Perhaps it was because the director was more interested in the placement of Pepsi cans than her performance, but I digress.Basically, this movie plays out like the cut scenes from a budget Xbox 360 game. From the ground up this thing just feels designed to fail. It feels almost Producersesque in its approach in just how every aspect is seemingly intentionally mangled, yet no one seems to care. How have we come so full circle to go through the glory of Infinity War/Logan/The Dark Knight to arrive all the way back to Batman and Robin and Catwoman levels of superhero flicks? (Bam!, Pow!, Gosh yes Batman!)How did this movie make it so far that it has an actual release, and no one stopped it? How did this idea get green lit? Why did Sony give 80 million and turn over their valuable IP to the people that wrote Morbius, Gods of Egypt, Dracula Untold and The Last Witch Hunter? How did this get past the writing process and again have that script greenlit? How could no one on the set at any point stop things? How did no one in the editing room point out how bad it looked and how much of a mess it was?But to the suits it's not about art and story. Instead it's about business, and people are just a commodity. It's cheaper to recycle known quantities, and practice nepotism and involve maybe less than talented friends, people you've worked with before, than go out and find artists with worthy stories. They don't care about art, they don't care about stories, they care about making this work for them financially, regardless of loss of reputation with audiences as a whole.Youtuber Chris Stuckmann did a deep dive on the topic of big studios being generally run by folks who came up through management rather than the creative rungs such as writing and directing when he discussed this film. His take is worth watching. For some reason, Chris doesn't do critical movie reviews since he has become a filmmaker, but I can tell by his tone that, like me, he was completely displeased watching this one. I'd avoid it.","2","17 February 2024"
"eoinageary","This is, well I guess this is a movie in the Sony universe that I'm SHOCKED is profitable.The story is all over the place, it's basically about Madame Web who is a paramedic and develops powers and can see into the future, with a current threat she tries to change the future, teaming up with 3 powerful characters who are yet to develop into their full potential so she must shield them and change the future to protect them.Trying not to give the little story that gets told away in the opening there but i have to be vague.What I liked, one or two good scenes, I didn't mind the end, I really liked a lot of the camera work some cool looking shots and a decent Score.But the movie is BAD, it makes Morbius look like The Batman 2022. The acting is lacking, the actors look as bored as you will feel. Script is bad, just some beyond silly lines, the story chops and changes so much your neck will hurt you, some bad CGI, and just boring action.And before people harp on about ""you don't like it because it's women leads"" no, it's just a crap film, I enjoyed the marvels, Black Widow was decent, so no, the movie regardless of its leads is just poor.Extremely disappointing, 3/10.","3","14 February 2024"
"tbunker-88294","I can honestly say that once again (not that anyone is surprised) that Sony has bombed again with its superhero content. Underwhelming action, bad characters, weird dialogue, generic villain. Its just plain badI feel bad for the cast of this movie, you have EXCELLENT talent and its just wasted in this cash grab excuse of a movieSony has proved once again it can't be trusted with superhero content and has lost what little credibility it had. If the company had any integrity or wits left they should sell their share of ownership back to Marvel and let them assume FULL creative control.I'm not optimistic for Kraven The Hunter after seeing this gross disappointment.","1","14 February 2024"
"hotrobinproductions","Horrible from beginning to end, the opening scene just reeks of awful predictability from story & plot to the core. You know exactly what will happen before it even happens, the script sucks & the dialogue is even worse. There is quite noticeable audio dub edited after the fact too. This budget is 80 million, not that budget matters, because no amount of money could have saved this train wreck, but I mention this because you can still make a good film on lower budgets, Shazam, the first one, had the same budget & delt with a lot of side characters too, it's miles better, Godzilla minus one had a extremely low budget too. But this 80 million dollar film not just effects but production, feels obviously cheap, it almost feels like watching a very long pilot episode to a CW tv show.You thought Morbius was bad, that film was bad because it did the bare minimum, this film doesn't even do the bare minimum, it goes beyond comprehension below that, it just enters a point of no originality or ambition towards creating anything. There isn't even a single superhero moment, even horrible films like catwoman or Morbius has superhero moments & action, this thing doesn't, you get instead visions of the future to potentially set up sequels.This movie also has a serious problem of product placement, it's a long commercial, to be exact a long Pepsi commercial, I feel like Pepsi stopped the halftime show so they could invest in the product placement in this film. This movie was more important to them than the superbowl LOL it's just so over the top & obviously placed way too much in this film. Calvin Klein, Chase bank, the list goes on. This movie should be called superhero product placement the movie.It's barely even close to a 1/10 the cool moments are seeing what we already saw in the trailer when she's seeing the future & you think it's happening now but then it goes back to the moment she realizes it's a vision, granted it's cool the first couple times but it gets old REAL quick. & it ends up getting annoying because it's abused way too much.Thats about it, there isn't any redeeming things in this film, the acting isn't even good. I would say the 3 side character spider women that Dakota finds when they are together there was a potential spark. I saw the talent & potential, but they are failed big time by such a horrid script that the spark never even sparks, it's just like showing you the matches & gasoline & not setting the fire.Madame M0RBIUS / 10.","1","16 February 2024"
